{"current":0.62,"history":[{"cause_event":"12","p":0.62,"seq":1}],"hypothesis_id":"vacuum_leak_post_maf","label":{"L1":"Air leak after the airflow sensor","L2":"Post-MAF vacuum leak","L3":"Unmetered air leak"},"origin":"kp","prior":0.15,"trace":[{"evidence_id":"ev_001","expected":"lean at idle, normal at cruise","likelihood_ratio":3.75,"lr_source":"trim_idle_vs_2500","measured":"lean at idle (+18%), normal at 2500 rpm (+4%)","posterior":0.62,"prior":0.15,"seq":1,"test_id":"t_001","text_L1":"Trims were high at idle but normal at speed, which fits an air leak.","text_L3":"Idle-only lean split (ΔLTFT idle−cruise ≈ 14%) gives LR 3.75 for unmetered air."}]}
